id,category,type,question,answer,dummy1,dummy2,dummy3,explanation
641,小6社会（歴史）,choice,縄文人が縄の模様をつけた土器を使って食べていた現代の日本の主食といえば何？,まだ米は作っていない（どんぐり等）,高級魚の寿司,カレーライス,炊き立ての白米,主食のお米作り（稲作）が本格的に日本へ伝わるのは弥生時代になってからなんだよ
642,小6社会（歴史）,choice,弥生時代に始まった邪馬台国の女王である卑弥呼も食べていたとされる本格的な農業は何？,稲作（お米づくり）,イチゴ栽培,トマトのハウス栽培,ジャガイモ畑,お米が作れるようになったことで保存ができるようになり ムラ同士の争い（戦争）が始まっちゃったんだ
643,小6社会（歴史）,choice,上から見ると巨大な鍵穴のような形をしている大昔の王様や権力者たちの巨大なお墓を何という？,古墳（こふん）,ピラミッド,タワーマンション,秘密基地,一番大きな大仙陵古墳（仁徳天皇陵）は世界三大お墓の一つで 上から見ないと鍵穴の形が分からないんだよ
644,小6社会（歴史）,choice,聖徳太子が定めた家柄ではなく個人の能力や手柄がある人を役人に選ぶための冠の色を使った決まりを何という？,冠位十二階,十七条の憲法,大化の改新,武家諸法度,一番エラい位の色は紫（むらさき）！家柄が低くても優秀なら大出世できる実力主義の画期的なルールだったんだ
645,小6社会（歴史）,choice,聖徳太子が役人たちに向けて和をもって貴しとなす（仲良くすることが一番大事）と説いた決まりは何？,十七条の憲法,冠位十二階,国家公務員法,大宝律令,法律というよりは心がまえ！ケンカをしないでしっかり話し合って国を豊かにしようというメッセージだよ
646,小6社会（歴史）,choice,奈良時代に聖武天皇が国を病気や災害から守るために大仏を作らせた東大寺がある都道府県はどこ？,奈良県,京都府,大阪府,東京都,大仏さまの手のひらには人が何人も乗れるくらいデカい！銅をたくさん溶かして金ピカにコーティングされていたんだ
647,小6社会（歴史）,choice,平安時代に藤原氏が自分の娘を天皇のきさき（奥さん）にすることで権力をにぎった政治のやり方を何という？,摂関政治（せっかん）,院政,幕府政治,独裁政治,おじいちゃん（藤原道長など）が幼い天皇の代わりに政治をコントロールしたよ この世をば我が世とぞ思うの歌が有名だね
648,小6社会（歴史）,choice,源頼朝が神奈川県に開いた日本で最初の本格的な武士による政権（幕府）を何という？,鎌倉幕府,室町幕府,江戸幕府,平氏政権,いい国（1192）作ろうと言われていたけれど今は1185年（いい箱作ろう）に始まったという説が教科書の主流だよ
649,小6社会（歴史）,choice,室町時代に足利義満が京都に建てたピカピカに光る金箔だらけの有名な建物は何？,金閣（鹿苑寺）,銀閣,東京タワー,大阪城,お釈迦様のお骨をまつるための豪華な建物！3階建てで1階・2階・3階の建築スタイルが全部違うオシャレ仕様なんだ
650,小6社会（歴史）,choice,室町時代に足利義政が京都に建てたあえてハデにせず落ち着いた渋さを感じる木造の建物は何？,銀閣（慈照寺）,金閣,五重塔,通天閣,金閣とは真逆の『わびさび（地味だけど深い味わい）』の世界！東山文化を代表する渋すぎるデザインだよ
651,小6社会（歴史）,choice,戦国時代の織田信長が武田氏の最強騎馬隊を最新兵器である鉄砲のチームプレイで打ち破った有名な戦いは？,長篠の戦い（ながしの）,桶狭間の戦い,関ヶ原の戦い,本能寺の変,鉄砲は弾を込めるのに時間がかかるから 3列に並んで順番に撃つという天才的な作戦（三段撃ち）で勝ったと言われている
652,小6社会（歴史）,choice,織田信長が信頼していた家臣の明智光秀に突然裏切られて炎の中で倒れた京都の有名な事件の場所はどこ？,本能寺（ほんのうじ）,東大寺,金閣寺,清水寺,敵は本能寺にあり！という名ゼリフが有名だね 天下統一の直前で夢が消えてしまった歴史の大大ニュースだよ
653,小6社会（歴史）,choice,豊臣秀吉が日本中の一揆（いっき）を防ぐために武士以外の人から刀や一揆の武器をすべて没収した政策を何という？,刀狩（かたながり）,太閤検地,生類憐れみの令,天下統一,没収した刀は溶かして大仏様を作るための釘やネジに使ったよ という言い訳をして農民から武器を奪ったんだ
654,小6社会（歴史）,choice,豊臣秀吉が日本中の田畑の広さや土地の良さを同じ物差しできっちり調べてお米の取れる量を計算した政策は何？,太閤検地（たいこうけんち）,刀狩,地租改正,班田収授の法,これによって『石高（こくだか）』というお米の量で大名の強さや税金（年貢）を決めるカチッとした仕組みができた
655,小6社会（歴史）,choice,徳川家康が率いる東軍が石田三成らの西軍をわずか1日で打ち破って天下人となった天下分け目の戦いはどこ？,関ヶ原の戦い（せきがはら）,本能寺の変,長篠の戦い,壇ノ浦の戦い,岐阜県にある関ヶ原に日本中の武将が集まって大激突したよ！家康の裏切り工作がスパッと決まって東軍が勝ったんだ
656,小6社会（歴史）,choice,江戸幕府が大名たちの反乱を防ぐために1年おきに江戸と自分の領地を行き来させて大金を強制的に使わせた仕組みは何？,参勤交代（さんきんこうたい）,武家諸法度,生類憐れみの令,禁中並公家諸法度,大名行列という大移動には何百人も参加したから 旅費や江戸の生活費で大名はお金がなくなって戦う体力が消えたんだ
657,小6社会（歴史）,choice,江戸時代にキリスト教の広がりを恐れた幕府が外国との貿易を長崎の出島だけに制限して国を閉ざした状態は何？,鎖国（さこく）,開国,貿易摩擦,植民地,オランダと中国の船だけが特別に出島にこれたよ 約200年間も日本は独自ののんびりした文化（江戸文化）を育てたんだ
658,小6社会（歴史）,choice,杉田玄白や前野良沢がオランダ語の医学書に描かれた解剖図の正確さに腰を抜かして必死で翻訳した日本の有名な医学書は何？,解体新書（かいたいしん書）,武士道,学問のすすめ,東海道中膝栗毛,骨や筋肉の名前を日本語に訳すのがウルトラ大変で『フルヘッヘンド（うつむく）』の意味がわかるまで何日も悩んだんだ
659,小6社会（歴史）,choice,江戸時代に50歳を過ぎてから日本中を自分の足で一歩ずつ歩いて測量しもの凄く正確な日本地図を完成させたおじさんは誰？,伊能忠敬（いのうただたか）,ペリー,坂本龍馬,杉田玄白,歩いた歩数と角度だけで地図を作ったよ！今の人工衛星から見た地図と重ね合わせても1ミリレベルしか狂っていない凄さ
660,小6社会（歴史）,choice,江戸時代の終わりにアメリカから黒い巨大な蒸気船（黒船）を率いて浦賀にやってきて大砲で脅しながら開国を迫った軍人は？,ペリー,マッカーサー,ワシントン,リンカーン,太平の眠りを覚ます上喜撰（高級お茶）という歌が詠まれるくらい当時の日本人は黒船パニックで大騒ぎになったんだ
661,小6社会（歴史）,choice,お犬様を大事にしすぎるあまり蚊を叩いただけでお説教されるような法律である生類憐れみの令を出した江戸幕府の5代将軍は誰？,徳川綱吉（つなよし）,徳川家康,徳川家光,徳川慶喜,犬のために豪華な専門のマンション（犬小屋）を建てて税金でご馳走を食べさせたから犬公方（いぬくぼう）と呼ばれたよ
662,小6社会（歴史）,choice,明治時代に新政府が出した武士の特権を無くして百姓や町人もみんな同じ立場であるとした方針を何という？,四民平等（しみんびょうどう）,版籍奉還,廃藩置県,大政奉還,刀を持つ特権がなくなった武士たちは大怒り！でも髪型をちょんまげから散切り頭（自由な髪型）に変える大ブームが起きた
663,小6社会（歴史）,choice,明治新政府がこれからは身分や男女に関係なくみんな小学校に行って勉強しなさいと定めた近代教育のルールは何？,学制（がくせい）,教育勅語,義務教育法,校則,最初は学校を建てるお金を自分たちで払わなきゃいけなかったから 農民たちが反対して一揆（学制一揆）が起きたこともある
664,小6社会（歴史）,choice,明治時代に外国に負けない大国になるために群馬県に作られた日本の近代化を支えた世界遺産の生糸（シルク）工場はどこ？,富岡製糸場（とみおかせいしじょう）,八幡製鉄所,トヨタ工場,日産工場,フランスから最新の機械と技師を呼んで作ったよ！全国から士族（元武士）の娘たちが集まってハイテク技術を学んだんだ
665,小6社会（歴史）,choice,一万円札の顔にもなっている明治時代に学問のすすめを書き天は人の上に人を造らずと言って勉強の大切さを説いた人は誰？,福沢諭吉（ゆきち）,樋口一葉,野口英世,渋沢栄一,勉強しないと貧しくなるけれど勉強すれば誰でも大出世できるというアメリカ風の自由な考え方を日本に広めたリーダーだよ
666,小6社会（歴史）,choice,千円札の顔で黄熱病（おうねつびょう）という恐ろしい病気の原因を突き止めるためにアフリカへ渡って命がけで戦った細菌学者は？,野口英世（ひでよ）,北里柴三郎,志賀潔,湯川秀樹,子どもの頃に左手に大火傷を負ったけれど大手術で動くようになり お医者さんになって世界中で大活躍した努力の天才だよ
667,小6社会（歴史）,choice,新しく始まった明治政府の中で日本で初めての内閣総理大臣（初代総理大臣）に就任した山口県出身の人物は誰？,伊藤博文（ひろぶみ）,板垣退助,大隈重信,犬養毅,若い頃はイギリスにこっそり留学（長州ファイブ）して最先端の技術を学んだよ！大日本帝国憲法を作る中心になった人だ
668,小6社会（歴史）,choice,国会を開いてみんなで話し合う政治をしようと自由民権運動を進め暴漢に襲われたとき板垣死すとも自由は死せずと言った人は？,板垣退助（たいすけ）,伊藤博文,西郷隆盛,大久保利通,日本で最初の本格的な政党（自由党）を作ったよ！100円札の顔になっていたこともあるヒゲが立派なおじさまだよ
669,小6社会（政治）,choice,国会が法律を決めて内閣がそれを実行し裁判所がルール違反を裁くという権力の暴走を防ぐ仕組みを何という？,三権分立（さんけんぶんりつ）,三位一体,多数決の原則,二大政党制,1つのグループ（例えば王様）が全部を決めると独裁になっちゃうから 3つのハコが互いに監視し合う賢いシステムなんだ
670,小6社会（政治）,choice,日本の法律のピラミッドの一番てっぺんにある国の最高法規であり国の形やみんなの人権を守る絶対ルールは何？,日本国憲法,民法,刑法,学校の校則,国の一番強い法律だから 憲法に違反するような怪しい法律や命令を国会や内閣が勝手に作ることは絶対にできないよ
671,小6社会（政治）,choice,日本国憲法の３つの大原則とは基本的人権の尊重と平和主義とあと一つ国を動かすボスは国民であるという原則は何？,国民主権（こくみんしゅけん）,資本主義,民主主義,安全第一,昔の明治憲法では天皇が主権（ボス）だったけれど 今の憲法では『私たち国民全員』が国を決めるリーダーなんだよ
672,小6社会（政治）,choice,日本国憲法で定められている国民の三大義務とは教育を受けさせる義務と勤労（働く）の義務とあと一つの絶対ルールは何？,納税の義務（税金を払う）,選挙に行く義務,兵役の義務,部屋の片付けの義務,税金をみんなで出し合うから 警察や消防署や教科書が無料で使えるんだよ！お買い物にかかる消費税もその一つだね
673,小6社会（政治）,choice,国民から選ばれた国会議員たちが集まって新しい法律を多数決でギザギザ決める国の唯一の立法機関（法律を作る場所）はどこ？,国会（こっかい）,内閣,最高裁判所,首相官邸,衆議院（しゅうぎいん）と参議院（さんぎいん）の2つの部屋に分かれていて 2回慎重にチェックして法律を決めるんだ
674,小6社会（政治）,choice,総理大臣（ボス）と各省庁の大臣たちが集まって国会が決めた法律や予算をもとに実際に国の仕事を動かすチームを何という？,内閣（ないかく）または行政機関,国会,裁判所,市役所,総理大臣がお家（首相官邸）に大臣たちを集めて会議（閣議）を開いて 日本の進む方向をテキパキ決めていくんだ
675,小6社会（政治）,choice,世の中の揉め事や犯罪について憲法や法律の物差しを使ってどっちが正しいかフェアに判断を下す場所はどこ？,裁判所（さいばんしょ）または司法機関,国会,内閣,警察署,有罪か無罪かを決める神聖な場所！間違った判断を防ぐために3回までやり直せる『三審制（さんしんせい）』があるよ
676,小6理科（水溶液）,choice,酸性の水溶液に青色のリトマス紙をつけると紙の色はどのように変化する？,赤色に変色する,黄色のまま動かない,紫色のグラデーション,真っ黒に焦げる,『おかあさん（青➔赤、酸性）』と覚えよう！レモン汁や炭酸水やお酢をたらすと一瞬でキレイな赤色に変わるよ
677,小6理科（水溶液）,choice,アルカリ性の水溶液に赤色のリトマス紙をつけると紙の色はどのように変化する？,青色に変色する,緑色になる,透明に透き通る,ピンクのドット柄に変身,『あお信号（赤➔青、アルカリ性）』と覚えよう！石鹸水や虫刺されのアンモニア水をたらすと青色にワープするよ
678,小6理科（水溶液）,choice,酸性でもアルカリ性でもないポカリスエットや真水や食塩水のようなリトマス紙がどっちも色を変えない安全な性質を何という？,中性（ちゅうせい）,両性,激性,無性,お肌に優しい中性洗剤の中性だよ！酸性とアルカリ性を混ぜ合わせるとお互いのパワーが消えて中性になる（中和というよ）
679,小6理科（水溶液）,choice,匂いを嗅ぐと鼻がツーンともぎ取れそうになるおしっこの匂い成分が溶けたアルカリ性の水溶液は何？,アンモニア水,塩酸,炭酸水,食酢,気体のアンモニアが水に溶けたもの！匂いは超ヤバいけれど水が蒸発すると何も残らず空気中に消えちゃう不思議な液体だ
680,小6理科（水溶液）,choice,理科の実験で使う強烈な酸性の液体で無色透明だけれど金属の鉄やアルミニウムをドロドロに溶かしちゃう危ない水溶液は何？,塩酸（えんさん）,アンモニア水,水酸化ナトリウム水溶液,食塩水,気体の塩化水素が水に溶けたもの！強烈な酸性だから目に入ったら大ピンチ！実験の時は必ずゴーグルをつけよう
681,小6理科（水溶液）,choice,一円玉の材料であるアルミニウムを強烈な塩酸の中に入れると泡を出して消えてしまいますがこのとき出る爆発する気体は何？,水素（すいそ）,酸素,二酸化炭素,窒素,宇宙で一番軽い気体！マッチの火を近づけると『ポンッ！』と音を立てて激しく燃えて水に変身するエネルギーの塊だよ
682,小6理科（水溶液）,choice,学校のチョークや貝殻（石灰石）に塩酸をダバダバかけると激しく泡を出して溶けますがこのとき出る炭酸ガスと同じ気体は何？,二酸化炭素,酸素,水素,アンモニア,石灰水（せっかいすい）に通すとミルクみたいに真っ白に濁るのが特徴！地球を温める温室効果ガスとしても有名だね
683,小6理科（気体）,choice,物を激しくハデに燃やす手助けをする性質（助燃性）があり私たちが生きていくために1秒も欠かせない空気中の気体は何？,酸素（さんそ）,二酸化炭素,窒素,水素,二酸化マンガンにオキシドールを混ぜるとシュワシュワ大量に作れるよ！これがないと火は一瞬で消えちゃうんだ
684,小6理科（気体）,choice,地球の空気の約8割（一番多い）を占めている気体。物を燃やすことも燃やす手助けもしない超おとなしい気体の名前は何？,窒素（ちっそ）,酸素,二酸化炭素,ヘリウム,お菓子のポテトチップスの袋の中にパンパンに入っているガスだよ！油が腐らないように守ってくれる縁の下の力持ちだ
685,小6理科（人体）,choice,私たちが食べたご飯が胃や腸を通るとき体の中に吸収しやすいように栄養をドロドロに分解してくれる液体をまとめて何という？,消化液（しょうかえき）,唾液だけ,血液,胃水,口の中の唾液（だえき）や胃の中の胃液など！ご飯のでんぷんを甘い糖に変えてエネルギーの燃料にするんだよ
686,小6理科（人体）,choice,胸のなかに左右セットである臓器。空気中の酸素を血液にゲットして全自動で二酸化炭素を外に捨てるガス交換の場所はどこ？,肺（はい）,心臓,胃,腎臓,鳥の巣のぶどうの房みたいに小さな空気の部屋（肺胞・はいほう）が何億個も集まっていて 効率よく空気を入れ替えるんだ
687,小6理科（人体）,choice,胸の真ん中より少し左にあり自分のグーの拳と同じサイズ。24時間休まずドクドク動いて全身に血液を送る筋肉のポンプはどこ？,心臓（しんぞう）,肺,肝臓,大腸,4つの部屋（右心房・右心室・左心房・左心室）に分かれていて 逆流を防ぐ弁がついているウルトラ精密なエンジンだよ
688,小6理科（人体）,choice,背中側に左右1つずつあるソラマメの形をした臓器。全身の汚れた血液からいらない水分やゴミをこし取っておしっこを作るフィルターは？,腎臓（じんぞう）,肝臓,胃,肺,24時間血液をキレイにし続けてくれるお掃除ロボット！ここで集められたゴミがおしっこになってトイレに流れるんだ
689,小6理科（人体）,choice,人間の体の中で一番大きくて重い工場のような臓器。栄養をキープしたりお酒や体の中の毒を消して（解毒）くれる場所はどこ？,肝臓（かんぞう）,心臓,胃,腎臓,500種類以上の仕事を同時にこなす超マルチタスクな化学工場！ここが使えなくなると人間は一瞬で毒が回って倒れちゃう
690,小6理科（植物）,choice,植物の葉っぱが太陽の光のエネルギーを使って水と二酸化炭素からでんぷん（栄養）と酸素をタダで作るミラクルな働きは何？,光合成（こうごうせい）,呼吸,発芽,蒸散,葉っぱの中の緑色の粒（葉緑体・ようりょくたい）で作られるよ！植物が地球の空気をキレイにしてくれているんだね
691,小6理科（植物）,choice,植物の葉っぱの裏側に顕微鏡で見るとたくさんある唇（くちびる）の形をした目に見えない小さな空気とお水の出入り口の穴は何？,気孔（きこう）,気管,葉脈,毛穴,ここから二酸化炭素を吸って酸素を出したり お水を水蒸気として空に逃がして自分の体温をコントロールしているよ
692,小6理科（植物）,choice,根っこから吸い上げたお水を葉っぱの小さな穴（気孔）から水蒸気として空へビュンビュン逃がす植物の汗かき現象を何という？,蒸散（じょうさん）,光合成,呼吸,発汗,これによってストローでお水を吸い上げるように 足元から頭のてっぺんまでお水と栄養を全身に行き渡らせるんだ
693,小6理科（大地）,choice,大昔の生き物の死骸や葉っぱや足跡が何万年も泥や砂のなかに閉じ込められて石のようにカチカチにコピーされたお宝は何？,化石（かせき）,ただの砂利,ダイヤモンド,埴輪,恐竜の骨だけでなくウンチの化石もあるよ！大昔の地球がどんな天気でどんな世界だったかを教えてくれるタイムカプセルだ
694,小6理科（大地）,choice,山を切り開いた崖（がけ）の地層からあたたかくて浅い海にしか住めないサンゴの化石が見つかりました。大昔そこはどんな場所だった？,あたたかくて浅い海だった,冷たくて深い海だった,アマゾンのジャングルだった,エベレストのような高い山のてっぺんだった,サンゴの化石のように大昔の環境を教えてくれる化石を『示相化石（しそうかせき）』というよ 小6理科の重要罠ワードだ
695,小6理科（大地）,choice,地震のすさまじい巨大パワーで地面や地層がペキッと割れて横や上下にズレてできた大地の巨大な割れ目のキズを何という？,断層（だんそう）,地層,クレーター,谷,今も動く危険がある断層を『活断層（かつだんそう）』というよ！このキズがガクッと動くことで大地震が発生するんだ
696,小6理科（天体）,choice,お月様が毎日形を変えて三日月や満月に満ち欠けして見えるのは月が太陽の光を反射しながらどこの周りをお散歩しているから？,地球のまわり,太陽のまわり,宇宙のまわり,動かない,月は自分で光るライトを持っていなくて太陽の光を浴びた面だけが光るよ 地球からの角度で光の見え方が変わるんだね
697,小6理科（生態系）,choice,草➔バッタ➔カマキリ➔鳥➔タヌキのように生き物たちが食う・食われるの関係で複雑な網の目のように繋がっている関係を何という？,食物網（しょくもつもう）または食物連鎖,植物図鑑,弱肉強食,友達の輪,一本の鎖（連鎖）ではなく複雑に絡み合っているから網（網）というよ！どれか1種類の生き物が絶滅すると全体が崩れちゃう
698,小6算数（分数）,choice,２÷３という割り算の計算。小数にすると0.6666と割り切れませんがこれを分数の形に変身させると一瞬でどう表せる？,３分の２,２分の３,6,23,割り算の記号を分数の線に変えるだけ！『わられる数（左）』が分子のてっぺんに乗っかって『わる数（右）』が下（分母）に潜り込む
699,小6算数（分数）,choice,分数のかけ算の絶対ルール！３分の２ × ５分の４ の計算。どうやって掛け算すればいい？,分母どうし分子どうしをそれぞれそのまま掛け算する,分母だけ掛け算する,通分して引き算する,斜めに足し算する,分数のかけ算は一番カンタン！上は上（2×4=8）下は下（3×5=15）で計算して15分の8がスマートに一瞬で出るよ
700,小6算数（分数）,choice,分数の割り算の絶対ルール！３分の２ ÷ ５分の４ の計算。割り算の記号をひっくり返して掛け算にするときどうすればいい？,わる数の分数を上下逆さま（逆数）にして掛け算する,そのまま分子だけ割り算する,全体を１０倍する,諦めて小数にする,割り算は後ろの分数をウルトラＣでひっくり返して（5分の4➔4分の5）普通のかけ算にする！これだけでパズルが解けるよ
701,小6算数（単位）,choice,体積（かさ）の単位換算！たて・よこ・高さがすべて1メートルの巨大なサイコロ（１立方メートル）の中に1リットルの牛乳パックは何個入る？,１０００個,１個,１０個,１００個,1立方メートルは100cm×100cm×100cm＝1000000立方センチメートル！1Lは1000立方センチメートルだから1000個分だ
