id,category,type,question,answer,dummy1,dummy2,dummy3,explanation
702,小6算数（図形）,choice,丸い円の面積（広さ）を計算したいとき学校の算数で習う一番有名な公式の組み合わせはどれ？,半径 × 半径 × ３.14,直径 × ３.14,底辺 × 高さ ÷ ２,たて × よこ,半径を2回かけて最後に魔法の数字3.14をかけるよ！中学受験では3.14の掛け算の暗記がハイスピード攻略の鍵になる
703,小6算数（図形）,choice,丸い円のまわりの長さ（円周・えんしゅう）を計算したいとき学校の算数で習う公式の組み合わせはどれ？,直径 × ３.14,半径 × 半径 × ３.14,一辺 × ４,対角線 × 対角線 ÷ ２,円のまわりは直径の約3倍（正確には3.14倍）になっているよ！だから直径に3.14をかければ一発で長さがわかるんだ
704,小6算数（図形）,choice,円柱（缶詰の形）や角柱（お菓子の箱の形）の体積（空間の広さ）を求めるすべての柱に共通するウルトラ公式は何？,底面積 × 高さ,縦 × 横 × 高さ,底辺 × 高さ ÷ ２,半径 × 半径 × ３.14,下の面の面積（底面積）のシートを 高さの分だけ上までギュイーンと積み上げるイメージ！これだけで全部の柱の体積が出る
705,小6算数（図形）,choice,とんがり帽子の形をした円すいやピラミッドの形をした角すいの体積。普通の柱の体積に何を掛け算すれば同じになる？,３分の１（または３で割る）,２分の１,１０倍,１００倍,尖っている立体（すい体）の体積は 同じ底面積と高さの柱の体積の『ちょうど3分の1』になるという宇宙の面白いルールがある
706,小6算数（割合）,choice,算数の難所である比（ひ）。３：４ の左と右に同じ数字をかけても比の割合は変わりません。等しい比になっているのはどれ？,6:08,5:06,9:10,30:04:00,どっちも2倍すると6：8になるよ！比をできるだけ小さな整数に直すことを『比を簡単にする』というから覚えておこう
707,小6算数（割合）,choice,お買い物の計算。Ｘが２倍、３倍になると、連動してＹも２倍、３倍にパワーアップする２つの数字の関係を何という？,比例（ひれい）,反比例,正比例,反動,片方が増えればもう片方も同じ倍数で増える！グラフに書くと原点（0）からまっすぐ右上に伸びるキレイな直線になるよ
708,小6算数（割合）,choice,片方が２倍、３倍に増えると、逆に相方が『２分の一、３分の一』に縮んでしまう、割り勘の人数と1人分のお金のような関係は何？,反比例（はんぴれい）,比例,正比例,反動,人数が2倍に増えれば1人払うお金は半分（2分の1）に減る！グラフに書くと綺麗なカーブ（双曲線）を描くのが特徴だ
709,小6算数（数）,choice,ゲームのステータス低下デバフなどでよく見る「０（ゼロ）」よりもさらに小さいマイナスの世界の数のことを算数の言葉で何という？,負の数（ふのすう）,正の数,無の数,逆の数,マイナス3度（℃）のマイナスだよ！逆に0より大きい普通のプラスの数のことは『正の数（せいのすう）』というんだ
710,小6算数（図形）,choice,ある図形を鏡に映したように一本の直線を折り目にしてパタンと折ると左右がピッタリ重なり合う性質を何という？,線対称（せんたいしょう）,点対称,非対称,絶対対称,漢字の『山』やアルファベットの『Ａ』の形！折り目の線のことを『対称の軸（じく）』というからテストで書こう
711,小6算数（図形）,choice,図形の真ん中にあるポチ（中心）を画鋲で止めてグルッと『１８０度（半分）』回転させたときに元の形と完全に重なる性質は何？,点対称（てんたいしょう）,線対称,左右対称,回転対称,トランプのカードの絵柄やアルファベットの『Ｎ』や『Ｓ』の形！真ん中の画鋲の点を『対称の中心』というよ
712,小6算数（速さ）,choice,算数の3大引っ掛けボスである速さ。時速６０ｋｍで爆走する車は２時間で何ｋｍ遠くまで進むことができる？,１２０ｋｍ,３０ｋｍ,６０ｋｍ,２４０ｋｍ,1時間に60km進むパワーだから2時間なら 60×2＝120km！『はじき（速さ・時間・距離）』のパズルを使いこなそう
713,小6算数（速さ）,choice,道のり（距離）を計算して求めたいとき『はじき』の円のパズルを思い浮かべると正しい数式の組み合わせはどれ？,速さ × 時間,速さ ÷ 時間,時間 ÷ 道のり,道のり ＋ 時間,横並びの『速さ』と『時間』を掛け算すれば上の『道のり』にワープするよ！割り算と掛け算の向きを絶対に間違えないでね
714,小6国語（熟語）,choice,熟語の組み立ての罠。読書（書を『読む』）や乗車（車に『乗る』）のように、上の漢字が動詞で下の漢字が目的語の組み合わせはどれ？,登山（山に『登る』から）,上下,軽量,新幹線,英語の動詞➔目的語（Verb + Object）の語順と同じ！漢字の並び方のルールを見抜くと国語のパズルが一気に解けるよ
715,小6国語（熟語）,choice,熟語の組み立て。高山（高い山）や長髪（長い髪）のように、上の漢字が形容詞になって下の漢字を詳しく説明しているのはどれ？,大洋（大きな洋だから）,売買,落選,左右,上の文字が下の文字をデコレーション（修飾・しゅうしょく）しているよ！言葉の意味を考えれば簡単に見抜けるよ
616,小6国語（四字熟語）,choice,十人十色（じゅうにんといろ）という四字熟語。みんなそれぞれ考え方や好みが違うから面白いという意味ですがこれと同じ意味の四字熟語はどれ？,三者三様（さんしゃさんよう）,一生懸命,弱肉強食,一石二鳥,3人いれば3つのやり方や個性があるという意味！みんな違ってみんないいという多様性の時代にぴったりな言葉だね
717,小6国語（四字熟語）,choice,一生懸命（いっしょうけんめい）という言葉。実は大昔の武士たちが一つの土地（領地）を命がけで守った歴史がもとになった本来の漢字は何？,一所懸命（いっしょけんめい）,一性懸命,一生懸命で正しい,一星懸命,『一つの場所（一所）』を命を懸けて守るから一所懸命！今では一生懸命と書くことが多いけれど元々は場所の意味だったんだ
718,小6国語（四字熟語）,choice,大自然のサファリパークのように強い生き物が弱い生き物をパクパク食べて栄える厳しい世界を表した四字熟語は何？,弱肉強食（じゃくにくきょうしょく）,十人十色,自給自足,油断大敵,弱い者の肉が強い者の食べ物になるという意味！人間社会でも油断しているとライバルに負けちゃう厳しい言葉だね
719,小6国語（四字熟語）,choice,無人島サバイバルのように生活に必要な食べ物や道具をすべて自分たちの力で手に入れてまかなう生活を表す四字熟語は何？,自給自足（じきゅうじそく）,弱肉強食,一生懸命,油断大敵,自分で給（給与）して自分で足（満足）にする！お庭でトマトを育てて食べるのもプチ自給自足を味わえるね
720,小6国語（四字熟語）,choice,油断大敵（ゆだんたいてき）の油断という言葉の由来。大昔のお寺の小坊主さんが毎日何をうっかり切らすとウルトラ怒られたことからきている？,灯りのための油（あぶら）,料理のお醤油,お風呂のお湯,車のガソリン,お寺のランプの油を切らすと真っ暗になっちゃうから 毎日ヒヤヒヤしながら見張っていたのが油断（油を断つ）の語源なんだよ
721,小6国語（ことわざ）,choice,情けは人のためならず という有名な言葉。小6のテストで一番狙われるこの言葉の本当の正しい意味はどれ？,人に親切にしておけばめぐりめぐって自分に良いことが返ってくる,人に優しくしすぎると甘やかすことになってその人のためにならない,親切は無駄である,お金を貸してはいけない,『人のためではなく（自分のために返ってくる）』という意味！冷たく突き放す意味だと勘違いしている人が日本中に大勢いるよ
722,小6国語（敬語）,choice,学校の先生や会社の社長などお世話になっている目上の相手の行動を『高めて』表現する大人の正しい敬語のグループは何？,尊敬語（そんけいご）,謙譲語,丁寧語,タメ口,相手をリスペクトして上に持ち上げる表現だよ！『先生がおっしゃる』や『社長がいらっしゃる』など使い分けが大事だね
723,小6国語（敬語）,choice,相手に対して自分や自分の家族の立場を『一歩へりくだらせて（低くして）』表現することで相手を敬う大人の敬語グループは何？,謙譲語（けんじょうご）,尊敬語,丁寧語,美化語,自分が一歩下がることで間接的に相手を上にする表現！『私が申し上げます』や『お家に伺います』などビジネスの基本だよ
724,小6国語（敬語）,choice,話す（言う）という言葉の敬語。先生がクラスのみんなに向かって何かを話したとき尊敬語として正しく言い換えた形はどれ？,おっしゃる,申す（もうす）,言う,言われる,『先生がおっしゃいました』がパーフェクトな日本語！自分が話すときは謙譲語の『申しました』になるから罠に気をつけよう
725,小6国語（敬語）,choice,行く（訪問する）という言葉の敬語。自分が先生の職員室やお家にこれから向かうとき謙譲語として正しい言葉はどれ？,伺う（うかがう）または参る,いらっしゃる,行く,おいでになる,相手の場所に『伺う（うかがう）』が正解！先生が行くときは尊敬語の『いらっしゃる』になるから上下関係をマスターしよう
726,小6国語（漢字）,choice,友達を裏切る（うらぎる）や裏口（うらぐち）に使われている裏という漢字。漢字のパーツ（部首）の分類では何の仲間？,衣（ころも・衣がえの仲間）,里（さと）,口（くち）,目,漢字の上側と下側にパカッと分かれているけれど実は『衣（ころも）』という服を意味する部首！服の裏側の意味からきているんだ
727,小6国語（漢字）,choice,危険（きけん）な山道の険という漢字と探検（たんけん）の検という漢字。大自然のゴツゴツした険しい崖の山を表す方に使う部首はどっち？,こざとへん（阝・山の階段の形）,きへん（木）,さんずい（氵）,にんべん（イ）,左側の『阝』は神様が上り下りする山のハシゴの形！だから険しい山や階段の意味を持つ漢字にはこざとへんがつくんだよ
728,小6国語（語彙）,choice,文章を書くとき。前のセリフと後ろのセリフの意見が真逆（はんたい）のメッセージになるときに使う便利なつなぎ言葉はどれ？,しかし（だが）,だから,つまり,そして,前の話をバサッとひっくり返す接続詞！『一生懸命勉強した。しかし不合格だった。』のようにドラマチックな展開を作るよ
729,小6国語（語彙）,choice,文章を書くとき。前の文の理由や原因をカチッと受けて後ろの文でその結果を伝えるときに使うつなぎ言葉はどれ？,したがって（だから）,あるいは,なぜなら,たとえば,原因➔結果を繋ぐハイウェイの言葉！『雨が降った。したがって試合は中止になった。』のように論理的な文章になるよ
730,小6国語（語彙）,choice,文章のなかで。前の文の内容を別のわかりやすい言葉で言い換えたり一言でまとめたりするときに使うつなぎ言葉はどれ？,つまり（要するに）,しかし,または,ちなみに,長い説明をキュッとコンパクトにする魔法の接続詞！『125かける8は1000だ。つまり一瞬で計算できる。』のように使うんだ
731,小6社会（歴史）,choice,縄文時代の人々が食べ終わった貝殻や魚の骨などを一箇所に捨てていた大昔のゴミ箱であり現代のタイムカプセルの場所は何？,貝塚（かいづか）,ゴミ箱,古墳,遺跡,ゴミだけど大昔の人が何を食べて生きていたかを教えてくれる超一級の歴史データ！東京の『大森貝塚』が歴史で一番有名だよ
732,小6社会（歴史）,choice,邪馬台国（やまたいこく）のミステリアスな女王で中国の魏という国に使者を送って親魏倭王（しんぎわおう）の金印をもらった人物は誰？,卑弥呼（ひみこ）,持統天皇,紫式部,北条政子,おまじないや占いの特殊能力を使って国をピシッとまとめていたとされるよ！彼女の大きなお墓がどこのあるかは今も謎なんだ
733,小6社会（歴史）,choice,飛鳥時代に中大兄皇子と中臣鎌足がタッグを組んで政治を独占していた蘇我氏を倒して始めた国のウルトラ大改革を何という？,大化の改新（たいかのかいしん）,大政奉還,明治維新,承久の乱,ここから日本の元号（大化など）がスタートしたよ！天皇を中心としたカチッとした新しい国づくりを目指したんだ
734,小6社会（歴史）,choice,平安時代のきらびやかな京都の宮廷を舞台にして世界最古の長編小説である源氏物語を華麗に書き上げた天才女性作家は誰？,紫式部（むらさきしきぶ）,清少納言,小野小町,樋口一葉,今の時代のアニメやドラマの元祖！イケメンの光源氏（ひかるげんじ）を主人公にした超大作ストーリーを書いて大ヒットした
735,小6社会（歴史）,choice,平安時代の京都の宮廷で自分の身の回りの面白いことや自然の美しさを春はあけぼのというエッセイ枕草子にまとめた女性は誰？,清少納言（せいしょうなごん）,紫式部,与謝野晶子,持統天皇,紫式部とはライバル関係！『夏は夜がおもしろい！冬は朝が寒くて最高！』みたいに自分の好きなものをテンポよく語ったエッセイだ
736,小6社会（歴史）,choice,鎌倉時代に日本を自分のなわばりにしようと海を渡って2回も大軍で攻めてきた最強のモンゴル帝国の襲来のことを何という？,元寇（げんこう）または蒙古襲来,応仁の乱,承久の乱,文禄の役,文永の役（ぶんえい）と弘安の役（こうあん）の2回！鎌倉武士たちが命がけで戦い 偶然激しい台風（神風）が吹いて守り切った
737,小6社会（歴史）,choice,室町時代の終わりに京都の街を11年間も燃やし尽くし日本中を戦国大名だらけの戦国時代へと突入させた大ゲンカの内乱は何？,応仁の乱（おうにんのらん）,大化の改新,本能寺の変,戊辰戦争,将軍の後継者を誰にするかで親戚一同が大ゲンカ！京都の街がすっかり焼け野原になっちゃった歴史のターニングポイントだ
738,小6社会（歴史）,choice,安土桃山時代にキリスト教を日本に初めて伝えるために鹿児島県にやってきたおでこの形がとても特徴的なイエズス会の宣教師は誰？,フランシスコ・ザビエル,ペリー,マゼラン,コロンブス,日本人に分かりやすくキリストの教えを伝えるために 漢字や日本語の辞書を作ったり南蛮の珍しいお土産を大名に配ったよ
739,小6社会（歴史）,choice,江戸幕府を開いた徳川家康。彼が大名たちに対して勝手にお城を直してはならぬ、許可なく結婚してはならぬと厳しく定めた法律は何？,武家諸法度（ぶけしょはっと）,御成敗式目,十七条の憲法,生類憐れみの令,違反した大名はお家取り潰し（クビ）にされる恐怖のルール！これによって大名たちは幕府に絶対に逆らえなくなったんだ
740,小6社会（歴史）,choice,明治時代の初めに近代国家になるために江戸時代の大名の領地（藩）を完全に廃止して新しく国の直轄の県を置いた大改革は何？,廃藩置県（はいはんちけん）,版籍奉還,地租改正,大政奉還,日本中の藩を一瞬で消し去って東京から知事を派遣したよ！武士の時代が完全に終わりを告げた明治の超ウルトラ大事件だ
